{
  "@type": "ada:XCTImageCollection",
  "ada:instrumentType": "micro-CT",
  "ada:xraySource": "sealed tube",
  "ada:xrayTargetMaterial": "tungsten",
  "ada:xrayTubeEnergy": 120.0,
  "ada:xrayTubeCurrent": 0.1,
  "ada:xrayTubePower": 12.0,
  "ada:beamFilterMaterial": "copper",
  "ada:beamFilterThickness": 0.5,
  "ada:sourceToDetectorDistance": "500 mm",
  "ada:sourceToObjectDistance": 200.0,
  "ada:detectorType": "flat panel",
  "ada:detectorSize": "2048x2048",
  "ada:detectorBinning": "1x1",
  "ada:numberOfProjections": 1440,
  "ada:numberOfSlices": 2000,
  "ada:numberOfFramesAveragedPerProjection": 4,
  "ada:rotationAngle": "360 degrees",
  "ada:rotationType": "step-and-shoot",
  "ada:imageExposure": 0.5,
  "ada:imageSize": "2048x2048",
  "ada:reconstructedVoxelSize": "5.0 micrometer",
  "ada:reconstructedDataFormat": "16-bit TIFF",
  "ada:reconstructionSoftware": "Nikon CT Pro 3D"
}